value_en	description_en	codesystem	code	description_code
Finland 	Finland 	snomedCT	SNOMEDCT:315426005	Residing in Finland (finding)
Congo 	Congo 	snomedCT	SNOMEDCT:315407002	Residing in Congo (finding)
Indonesia 	Indonesia 	snomedCT	SNOMEDCT:315445001	Residing in Indonesia (finding)
Peru 	Peru 	snomedCT	SNOMEDCT:315501003	Residing in Peru (finding)
Georgia 	Georgia 	snomedCT	SNOMEDCT:315430008	Residing in Georgia (finding)
Mongolia 	Mongolia 	snomedCT	SNOMEDCT:315482005	Residing in Mongolia (finding)
Angola 	Angola 	snomedCT	SNOMEDCT:315369003	Residing in Angola (finding)
Denmark 	Denmark 	snomedCT	SNOMEDCT:315414000	Residing in Denmark (finding)
Belize 	Belize 	snomedCT	SNOMEDCT:315382006	Residing in Belize (finding)
Malta 	Malta 	snomedCT	SNOMEDCT:315476007	Residing in Malta (finding)
Australia 	Australia 	snomedCT	SNOMEDCT:315374006	Residing in Australia (finding)
Switzerland 	Switzerland 	snomedCT	SNOMEDCT:315535000	Residing in Switzerland (finding)
Maldives 	Maldives 	snomedCT	SNOMEDCT:315474005	Residing in Maldives (finding)
Central African Republic 	Central African Republic 	snomedCT	SNOMEDCT:315400000	Residing in Central African Republic (finding)
Bhutan 	Bhutan 	snomedCT	SNOMEDCT:315385008	Residing in Bhutan (finding)
Syria 	Syria 	snomedCT	SNOMEDCT:315536004	Residing in Syria (finding)
Zimbabwe 	Zimbabwe 	snomedCT	SNOMEDCT:315565005	Residing in Zimbabwe (finding)
Croatia 	Croatia 	snomedCT	SNOMEDCT:315409004	Residing in Croatia (finding)
Ivory Coast 	Ivory Coast 	snomedCT	SNOMEDCT:315451006	Residing in Ivory Coast (finding)
Vatican City 	Vatican City 	snomedCT	SNOMEDCT:315557007	Residing in Vatican City (finding)
Laos 	Laos 	snomedCT	SNOMEDCT:315461004	Residing in Laos (finding)
England 	England 	snomedCT	SNOMEDCT:315421000	Residing in England (finding)
Haiti 	Haiti 	snomedCT	SNOMEDCT:315439009	Residing in Haiti (finding)
Canada 	Canada 	snomedCT	SNOMEDCT:315398004	Residing in Canada (finding)
Philippines 	Philippines 	snomedCT	SNOMEDCT:315502005	Residing in Philippines (finding)
Moldavia 	Moldavia 	snomedCT	SNOMEDCT:315480002	Residing in Moldavia (finding)
Niger 	Niger 	snomedCT	SNOMEDCT:315490005	Residing in Niger (finding)
Cuba 	Cuba 	snomedCT	SNOMEDCT:315410009	Residing in Cuba (finding)
Comoros Islands 	Comoros Islands 	snomedCT	SNOMEDCT:315406006	Residing in Comoros Islands (finding)
Turkmenistan 	Turkmenistan 	snomedCT	SNOMEDCT:315548001	Residing in Turkmenistan (finding)
Argentina 	Argentina 	snomedCT	SNOMEDCT:315372005	Residing in Argentina (finding)
Nepal 	Nepal 	snomedCT	SNOMEDCT:315487004	Residing in Nepal (finding)
Nigeria 	Nigeria 	snomedCT	SNOMEDCT:315491009	Residing in Nigeria (finding)
Germany 	Germany 	snomedCT	SNOMEDCT:315431007	Residing in Germany (finding)
Hong Kong 	Hong Kong 	snomedCT	SNOMEDCT:315441005	Residing in Hong Kong (finding)
USA 	USA 	snomedCT	SNOMEDCT:315550009	Residing in USA (finding)
Sri Lanka 	Sri Lanka 	snomedCT	SNOMEDCT:315527003	Residing in Sri Lanka (finding)
Mali 	Mali 	snomedCT	SNOMEDCT:315475006	Residing in Mali (finding)
Iran 	Iran 	snomedCT	SNOMEDCT:315446000	Residing in Iran (finding)
Sweden 	Sweden 	snomedCT	SNOMEDCT:315534001	Residing in Sweden (finding)
Djibouti 	Djibouti 	snomedCT	SNOMEDCT:315415004	Residing in Djibouti (finding)
Jordan 	Jordan 	snomedCT	SNOMEDCT:315454003	Residing in Jordan (finding)
Lebanon 	Lebanon 	snomedCT	SNOMEDCT:315463001	Residing in Lebanon (finding)
Tonga 	Tonga 	snomedCT	SNOMEDCT:315544004	Residing in Tonga (finding)
Malaysia 	Malaysia 	snomedCT	SNOMEDCT:315473004	Residing in Malaysia (finding)
North Korea 	North Korea 	snomedCT	SNOMEDCT:315492002	Residing in North Korea (finding)
Republic of Korea 	Republic of Korea 	snomedCT	SNOMEDCT:315508009	Residing in Republic of Korea (finding)
Poland 	Poland 	snomedCT	SNOMEDCT:315503000	Residing in Poland (finding)
Estonia 	Estonia 	snomedCT	SNOMEDCT:315423002	Residing in Estonia (finding)
Hungary 	Hungary 	snomedCT	SNOMEDCT:315442003	Residing in Hungary (finding)
Spain 	Spain 	snomedCT	SNOMEDCT:315526007	Residing in Spain (finding)
Trinidad and Tobago 	Trinidad and Tobago 	snomedCT	SNOMEDCT:315545003	Residing in Trinidad and Tobago (finding)
Afghanistan 	Afghanistan 	snomedCT	SNOMEDCT:315365009	Residing in Afghanistan (finding)
Benin 	Benin 	snomedCT	SNOMEDCT:315384007	Residing in Benin (finding)
Papua New Guinea 	Papua New Guinea 	snomedCT	SNOMEDCT:315499006	Residing in Papua New Guinea (finding)
Bahrain 	Bahrain 	snomedCT	SNOMEDCT:315378009	Residing in Bahrain (finding)
Israel 	Israel 	snomedCT	SNOMEDCT:315449007	Residing in Israel (finding)
St. Lucia 	St. Lucia 	snomedCT	SNOMEDCT:315529000	Residing in St. Lucia (finding)
Lithuania 	Lithuania 	snomedCT	SNOMEDCT:315468005	Residing in Lithuania (finding)
Mauritius 	Mauritius 	snomedCT	SNOMEDCT:315478008	Residing in Mauritius (finding)
Saudi Arabia 	Saudi Arabia 	snomedCT	SNOMEDCT:315514002	Residing in Saudi Arabia (finding)
South Africa 	South Africa 	snomedCT	SNOMEDCT:315524005	Residing in South Africa (finding)
United Arab Emirates 	United Arab Emirates 	snomedCT	SNOMEDCT:315553006	Residing in United Arab Emirates (finding)
Czech Republic 	Czech Republic 	snomedCT	SNOMEDCT:315412001	Residing in Czech Republic (finding)
Taiwan 	Taiwan 	snomedCT	SNOMEDCT:315537008	Residing in Taiwan (finding)
Zambia 	Zambia 	snomedCT	SNOMEDCT:315564009	Residing in Zambia (finding)
Burkina Faso 	Burkina Faso 	snomedCT	SNOMEDCT:315393008	Residing in Burkina Faso (finding)
Paraguay 	Paraguay 	snomedCT	SNOMEDCT:315500002	Residing in Paraguay (finding)
Kosovo 	Kosovo 	snomedCT	SNOMEDCT:315458000	Residing in Kosovo (finding)
Bosnia - Herzegovnia 	Bosnia - Herzegovnia 	snomedCT	SNOMEDCT:315387000	Residing in Bosnia - Herzegovnia (finding)
Cyprus 	Cyprus 	snomedCT	SNOMEDCT:315411008	Residing in Cyprus (finding)
Seychelles 	Seychelles 	snomedCT	SNOMEDCT:315517009	Residing in Seychelles (finding)
Antigua and Barbuda 	Antigua and Barbuda 	snomedCT	SNOMEDCT:315370002	Residing in Antigua and Barbuda (finding)
Kyrgyzstan 	Kyrgyzstan 	snomedCT	SNOMEDCT:315460003	Residing in Kyrgyzstan (finding)
Madagascar 	Madagascar 	snomedCT	SNOMEDCT:315470001	Residing in Madagascar (finding)
Columbia 	Columbia 	snomedCT	SNOMEDCT:315405005	Residing in Columbia (finding)
Nauru 	Nauru 	snomedCT	SNOMEDCT:315486008	Residing in Nauru (finding)
Uganda 	Uganda 	snomedCT	SNOMEDCT:315551008	Residing in Uganda (finding)
Sierra Leone 	Sierra Leone 	snomedCT	SNOMEDCT:315518004	Residing in Sierra Leone (finding)
Chile 	Chile 	snomedCT	SNOMEDCT:315403003	Residing in Chile (finding)
Gabon 	Gabon 	snomedCT	SNOMEDCT:315428006	Residing in Gabon (finding)
Norway 	Norway 	snomedCT	SNOMEDCT:315494001	Residing in Norway (finding)
St. Vincent 	St. Vincent 	snomedCT	SNOMEDCT:315530005	Residing in St. Vincent (finding)
Kazakhstan 	Kazakhstan 	snomedCT	SNOMEDCT:315455002	Residing in Kazakhstan (finding)
Grenada 	Grenada 	snomedCT	SNOMEDCT:315434004	Residing in Grenada (finding)
Costa Rica 	Costa Rica 	snomedCT	SNOMEDCT:315408007	Residing in Costa Rica (finding)
Nicaragua 	Nicaragua 	snomedCT	SNOMEDCT:315489001	Residing in Nicaragua (finding)
El Salvador 	El Salvador 	snomedCT	SNOMEDCT:315420004	Residing in El Salvador (finding)
Egypt 	Egypt 	snomedCT	SNOMEDCT:315419005	Residing in Egypt (finding)
Cameroon 	Cameroon 	snomedCT	SNOMEDCT:315397009	Residing in Cameroon (finding)
Somalia 	Somalia 	snomedCT	SNOMEDCT:315523004	Residing in Somalia (finding)
Honduras 	Honduras 	snomedCT	SNOMEDCT:315440006	Residing in Honduras (finding)
Zaire 	Zaire 	snomedCT	SNOMEDCT:315563003	Residing in Zaire (finding)
Vietnam 	Vietnam 	snomedCT	SNOMEDCT:315559005	Residing in Vietnam (finding)
Luxembourg 	Luxembourg 	snomedCT	SNOMEDCT:315469002	Residing in Luxembourg (finding)
Panama 	Panama 	snomedCT	SNOMEDCT:315498003	Residing in Panama (finding)
Western Samoa 	Western Samoa 	snomedCT	SNOMEDCT:315561001	Residing in Western Samoa (finding)
Guyana 	Guyana 	snomedCT	SNOMEDCT:315438001	Residing in Guyana (finding)
Yemen 	Yemen 	snomedCT	SNOMEDCT:315590007	Residing in Yemen (finding)
Algeria 	Algeria 	snomedCT	SNOMEDCT:315367001	Residing in Algeria (finding)
Bahamas 	Bahamas 	snomedCT	SNOMEDCT:315377004	Residing in Bahamas (finding)
Romania 	Romania 	snomedCT	SNOMEDCT:315509001	Residing in Romania (finding)
Burma 	Burma 	snomedCT	SNOMEDCT:315394002	Residing in Burma (finding)
Iceland 	Iceland 	snomedCT	SNOMEDCT:315443008	Residing in Iceland (finding)
Tuvala 	Tuvala 	snomedCT	SNOMEDCT:315549009	Residing in Tuvala (finding)
China 	China 	snomedCT	SNOMEDCT:315404009	Residing in China (finding)
Azerbaijan 	Azerbaijan 	snomedCT	SNOMEDCT:315376008	Residing in Azerbaijan (finding)
Libya 	Libya 	snomedCT	SNOMEDCT:315466009	Residing in Libya (finding)
Sudan 	Sudan 	snomedCT	SNOMEDCT:315531009	Residing in Sudan (finding)
South Korea 	South Korea 	snomedCT	SNOMEDCT:315525006	Residing in South Korea (finding)
Russia 	Russia 	snomedCT	SNOMEDCT:315510006	Residing in Russia (finding)
Qatar 	Qatar 	snomedCT	SNOMEDCT:315506008	Residing in Qatar (finding)
Guatemala 	Guatemala 	snomedCT	SNOMEDCT:315435003	Residing in Guatemala (finding)
Latvia 	Latvia 	snomedCT	SNOMEDCT:315462006	Residing in Latvia (finding)
Greece 	Greece 	snomedCT	SNOMEDCT:315433005	Residing in Greece (finding)
Venezuela 	Venezuela 	snomedCT	SNOMEDCT:315558002	Residing in Venezuela (finding)
Namibia 	Namibia 	snomedCT	SNOMEDCT:315485007	Residing in Namibia (finding)
Kenya 	Kenya 	snomedCT	SNOMEDCT:315456001	Residing in Kenya (finding)
Tunisia 	Tunisia 	snomedCT	SNOMEDCT:315546002	Residing in Tunisia (finding)
Bangladesh 	Bangladesh 	snomedCT	SNOMEDCT:315379001	Residing in Bangladesh (finding)
Scotland 	Scotland 	snomedCT	SNOMEDCT:315515001	Residing in Scotland (finding)
Uruguay 	Uruguay 	snomedCT	SNOMEDCT:315554000	Residing in Uruguay (finding)
Morocco 	Morocco 	snomedCT	SNOMEDCT:315483000	Residing in Morocco (finding)
Jamaica 	Jamaica 	snomedCT	SNOMEDCT:315452004	Residing in Jamaica (finding)
Malawi 	Malawi 	snomedCT	SNOMEDCT:315471002	Residing in Malawi (finding)
Suriname 	Suriname 	snomedCT	SNOMEDCT:315532002	Residing in Suriname (finding)
The Netherlands 	The Netherlands 	snomedCT	SNOMEDCT:315542000	Residing in The Netherlands (finding)
Belgium 	Belgium 	snomedCT	SNOMEDCT:315381004	Residing in Belgium (finding)
St. Kitts and Nevis 	St. Kitts and Nevis 	snomedCT	SNOMEDCT:315528008	Residing in St. Kitts and Nevis (finding)
Uzbekistan 	Uzbekistan 	snomedCT	SNOMEDCT:315555004	Residing in Uzbekistan (finding)
Tanzania 	Tanzania 	snomedCT	SNOMEDCT:315539006	Residing in Tanzania (finding)
Kuwait 	Kuwait 	snomedCT	SNOMEDCT:315459008	Residing in Kuwait (finding)
New Zealand 	New Zealand 	snomedCT	SNOMEDCT:315488009	Residing in New Zealand (finding)
British Guyana 	British Guyana 	snomedCT	SNOMEDCT:315390006	Residing in British Guyana (finding)
Ecuador 	Ecuador 	snomedCT	SNOMEDCT:315418002	Residing in Ecuador (finding)
Albania 	Albania 	snomedCT	SNOMEDCT:315366005	Residing in Albania (finding)
San Marino 	San Marino 	snomedCT	SNOMEDCT:315512003	Residing in San Marino (finding)
Equatorial Guinea 	Equatorial Guinea 	snomedCT	SNOMEDCT:315422007	Residing in Equatorial Guinea (finding)
Northern Ireland 	Northern Ireland 	snomedCT	SNOMEDCT:315493007	Residing in Northern Ireland (finding)
Democratic People's Republic of Korea 	Democratic People's Republic of Korea 	snomedCT	SNOMEDCT:315413006	Residing in Democratic People's Republic of Korea (finding)
Singapore 	Singapore 	snomedCT	SNOMEDCT:315519007	Residing in Singapore (finding)
Liberia 	Liberia 	snomedCT	SNOMEDCT:315465008	Residing in Liberia (finding)
Wales 	Wales 	snomedCT	SNOMEDCT:315560000	Residing in Wales (finding)
Burundi 	Burundi 	snomedCT	SNOMEDCT:315395001	Residing in Burundi (finding)
Oman 	Oman 	snomedCT	SNOMEDCT:315495000	Residing in Oman (finding)
Rwanda 	Rwanda 	snomedCT	SNOMEDCT:315511005	Residing in Rwanda (finding)
Belorussia 	Belorussia 	snomedCT	SNOMEDCT:315383001	Residing in Belorussia (finding)
Puerto Rico 	Puerto Rico 	snomedCT	SNOMEDCT:315505007	Residing in Puerto Rico (finding)
Fiji 	Fiji 	snomedCT	SNOMEDCT:315425009	Residing in Fiji (finding)
Kiribati 	Kiribati 	snomedCT	SNOMEDCT:315457005	Residing in Kiribati (finding)
Turkey 	Turkey 	snomedCT	SNOMEDCT:315547006	Residing in Turkey (finding)
Senegal 	Senegal 	snomedCT	SNOMEDCT:315516000	Residing in Senegal (finding)
Guinea Bissau 	Guinea Bissau 	snomedCT	SNOMEDCT:315436002	Residing in Guinea Bissau (finding)
Austria 	Austria 	snomedCT	SNOMEDCT:315375007	Residing in Austria (finding)
Mozambique 	Mozambique 	snomedCT	SNOMEDCT:315484006	Residing in Mozambique (finding)
Chad 	Chad 	snomedCT	SNOMEDCT:315401001	Residing in Chad (finding)
Armenia 	Armenia 	snomedCT	SNOMEDCT:315373000	Residing in Armenia (finding)
Botswana 	Botswana 	snomedCT	SNOMEDCT:315388005	Residing in Botswana (finding)
Bulgaria 	Bulgaria 	snomedCT	SNOMEDCT:315392003	Residing in Bulgaria (finding)
Ghana 	Ghana 	snomedCT	SNOMEDCT:315432000	Residing in Ghana (finding)
Barbados 	Barbados 	snomedCT	SNOMEDCT:315380003	Residing in Barbados (finding)
Chechnya 	Chechnya 	snomedCT	SNOMEDCT:315402008	Residing in Chechnya (finding)
Slovakia 	Slovakia 	snomedCT	SNOMEDCT:315520001	Residing in Slovakia (finding)
Mauritania 	Mauritania 	snomedCT	SNOMEDCT:315477003	Residing in Mauritania (finding)
Andorra 	Andorra 	snomedCT	SNOMEDCT:315368006	Residing in Andorra (finding)
Ireland 	Ireland 	snomedCT	SNOMEDCT:315448004	Residing in Ireland (finding)
Republic of Ireland 	Republic of Ireland 	snomedCT	SNOMEDCT:315507004	Residing in Republic of Ireland (finding)
Italy 	Italy 	snomedCT	SNOMEDCT:315450007	Residing in Italy (finding)
Thailand 	Thailand 	snomedCT	SNOMEDCT:315540008	Residing in Thailand (finding)
India 	India 	snomedCT	SNOMEDCT:315444002	Residing in India (finding)
Tajikistan 	Tajikistan 	snomedCT	SNOMEDCT:315538003	Residing in Tajikistan (finding)
Pakistan 	Pakistan 	snomedCT	SNOMEDCT:315496004	Residing in Pakistan (finding)
Palestine 	Palestine 	snomedCT	SNOMEDCT:315497008	Residing in Palestine (finding)
Swaziland 	Swaziland 	snomedCT	SNOMEDCT:315533007	Residing in Swaziland (finding)
Ethiopia 	Ethiopia 	snomedCT	SNOMEDCT:315424008	Residing in Ethiopia (finding)
Yugoslavia 	Yugoslavia 	snomedCT	SNOMEDCT:315562008	Residing in Yugoslavia (finding)
Portugal 	Portugal 	snomedCT	SNOMEDCT:315504006	Residing in Portugal (finding)
Togo 	Togo 	snomedCT	SNOMEDCT:315543005	Residing in Togo (finding)
Japan 	Japan 	snomedCT	SNOMEDCT:315453009	Residing in Japan (finding)
Gambia 	Gambia 	snomedCT	SNOMEDCT:315429003	Residing in Gambia (finding)
Guinea Republic 	Guinea Republic 	snomedCT	SNOMEDCT:315437006	Residing in Guinea Republic (finding)
Iraq 	Iraq 	snomedCT	SNOMEDCT:315447009	Residing in Iraq (finding)
Vanuatu 	Vanuatu 	snomedCT	SNOMEDCT:315556003	Residing in Vanuatu (finding)
Bolivia 	Bolivia 	snomedCT	SNOMEDCT:315386009	Residing in Bolivia (finding)
Cape Verde Islands 	Cape Verde Islands 	snomedCT	SNOMEDCT:315399007	Residing in Cape Verde Islands (finding)
Lesotho 	Lesotho 	snomedCT	SNOMEDCT:315464007	Residing in Lesotho (finding)
Dominican Republic 	Dominican Republic 	snomedCT	SNOMEDCT:315416003	Residing in Dominican Republic (finding)
Sao Tome and Principe 	Sao Tome and Principe 	snomedCT	SNOMEDCT:315513008	Residing in Sao Tome and Principe (finding)
Monaco 	Monaco 	snomedCT	SNOMEDCT:315481003	Residing in Monaco (finding)
Slovenia 	Slovenia 	snomedCT	SNOMEDCT:315521002	Residing in Slovenia (finding)
East Timor 	East Timor 	snomedCT	SNOMEDCT:315417007	Residing in East Timor (finding)
France 	France 	snomedCT	SNOMEDCT:315427001	Residing in France (finding)
Mexico 	Mexico 	snomedCT	SNOMEDCT:315479000	Residing in Mexico (finding)
Brazil 	Brazil 	snomedCT	SNOMEDCT:315389002	Residing in Brazil (finding)
Cambodia 	Cambodia 	snomedCT	SNOMEDCT:315396000	Residing in Cambodia (finding)
Solomon Islands 	Solomon Islands 	snomedCT	SNOMEDCT:315522009	Residing in Solomon Islands (finding)
Ukraine 	Ukraine 	snomedCT	SNOMEDCT:315552001	Residing in Ukraine (finding)
Brunei 	Brunei 	snomedCT	SNOMEDCT:315391005	Residing in Brunei (finding)
Liechtenstein 	Liechtenstein 	snomedCT	SNOMEDCT:315467000	Residing in Liechtenstein (finding)
