value_en	description_en	codesystem	code	description_code
Finland 	Finland 	snomedCT	SNOMEDCT:315426005	Ethnic origins in Finland (finding)
Congo 	Congo 	snomedCT	SNOMEDCT:315407002	Ethnic origins in Congo (finding)
Indonesia 	Indonesia 	snomedCT	SNOMEDCT:315445001	Ethnic origins in Indonesia (finding)
Peru 	Peru 	snomedCT	SNOMEDCT:315501003	Ethnic origins in Peru (finding)
Georgia 	Georgia 	snomedCT	SNOMEDCT:315430008	Ethnic origins in Georgia (finding)
Mongolia 	Mongolia 	snomedCT	SNOMEDCT:315482005	Ethnic origins in Mongolia (finding)
Angola 	Angola 	snomedCT	SNOMEDCT:315369003	Ethnic origins in Angola (finding)
Denmark 	Denmark 	snomedCT	SNOMEDCT:315414000	Ethnic origins in Denmark (finding)
Belize 	Belize 	snomedCT	SNOMEDCT:315382006	Ethnic origins in Belize (finding)
Malta 	Malta 	snomedCT	SNOMEDCT:315476007	Ethnic origins in Malta (finding)
Australia 	Australia 	snomedCT	SNOMEDCT:315374006	Ethnic origins in Australia (finding)
Switzerland 	Switzerland 	snomedCT	SNOMEDCT:315535000	Ethnic origins in Switzerland (finding)
Maldives 	Maldives 	snomedCT	SNOMEDCT:315474005	Ethnic origins in Maldives (finding)
Central African Republic 	Central African Republic 	snomedCT	SNOMEDCT:315400000	Ethnic origins in Central African Republic (finding)
Bhutan 	Bhutan 	snomedCT	SNOMEDCT:315385008	Ethnic origins in Bhutan (finding)
Syria 	Syria 	snomedCT	SNOMEDCT:315536004	Ethnic origins in Syria (finding)
Zimbabwe 	Zimbabwe 	snomedCT	SNOMEDCT:315565005	Ethnic origins in Zimbabwe (finding)
Croatia 	Croatia 	snomedCT	SNOMEDCT:315409004	Ethnic origins in Croatia (finding)
Ivory Coast 	Ivory Coast 	snomedCT	SNOMEDCT:315451006	Ethnic origins in Ivory Coast (finding)
Vatican City 	Vatican City 	snomedCT	SNOMEDCT:315557007	Ethnic origins in Vatican City (finding)
Laos 	Laos 	snomedCT	SNOMEDCT:315461004	Ethnic origins in Laos (finding)
England 	England 	snomedCT	SNOMEDCT:315421000	Ethnic origins in England (finding)
Haiti 	Haiti 	snomedCT	SNOMEDCT:315439009	Ethnic origins in Haiti (finding)
Canada 	Canada 	snomedCT	SNOMEDCT:315398004	Ethnic origins in Canada (finding)
Philippines 	Philippines 	snomedCT	SNOMEDCT:315502005	Ethnic origins in Philippines (finding)
Moldavia 	Moldavia 	snomedCT	SNOMEDCT:315480002	Ethnic origins in Moldavia (finding)
Niger 	Niger 	snomedCT	SNOMEDCT:315490005	Ethnic origins in Niger (finding)
Cuba 	Cuba 	snomedCT	SNOMEDCT:315410009	Ethnic origins in Cuba (finding)
Comoros Islands 	Comoros Islands 	snomedCT	SNOMEDCT:315406006	Ethnic origins in Comoros Islands (finding)
Turkmenistan 	Turkmenistan 	snomedCT	SNOMEDCT:315548001	Ethnic origins in Turkmenistan (finding)
Argentina 	Argentina 	snomedCT	SNOMEDCT:315372005	Ethnic origins in Argentina (finding)
Nepal 	Nepal 	snomedCT	SNOMEDCT:315487004	Ethnic origins in Nepal (finding)
Nigeria 	Nigeria 	snomedCT	SNOMEDCT:315491009	Ethnic origins in Nigeria (finding)
Germany 	Germany 	snomedCT	SNOMEDCT:315431007	Ethnic origins in Germany (finding)
Hong Kong 	Hong Kong 	snomedCT	SNOMEDCT:315441005	Ethnic origins in Hong Kong (finding)
USA 	USA 	snomedCT	SNOMEDCT:315550009	Ethnic origins in USA (finding)
Sri Lanka 	Sri Lanka 	snomedCT	SNOMEDCT:315527003	Ethnic origins in Sri Lanka (finding)
Mali 	Mali 	snomedCT	SNOMEDCT:315475006	Ethnic origins in Mali (finding)
Iran 	Iran 	snomedCT	SNOMEDCT:315446000	Ethnic origins in Iran (finding)
Sweden 	Sweden 	snomedCT	SNOMEDCT:315534001	Ethnic origins in Sweden (finding)
Djibouti 	Djibouti 	snomedCT	SNOMEDCT:315415004	Ethnic origins in Djibouti (finding)
Jordan 	Jordan 	snomedCT	SNOMEDCT:315454003	Ethnic origins in Jordan (finding)
Lebanon 	Lebanon 	snomedCT	SNOMEDCT:315463001	Ethnic origins in Lebanon (finding)
Tonga 	Tonga 	snomedCT	SNOMEDCT:315544004	Ethnic origins in Tonga (finding)
Malaysia 	Malaysia 	snomedCT	SNOMEDCT:315473004	Ethnic origins in Malaysia (finding)
North Korea 	North Korea 	snomedCT	SNOMEDCT:315492002	Ethnic origins in North Korea (finding)
Republic of Korea 	Republic of Korea 	snomedCT	SNOMEDCT:315508009	Ethnic origins in Republic of Korea (finding)
Poland 	Poland 	snomedCT	SNOMEDCT:315503000	Ethnic origins in Poland (finding)
Estonia 	Estonia 	snomedCT	SNOMEDCT:315423002	Ethnic origins in Estonia (finding)
Hungary 	Hungary 	snomedCT	SNOMEDCT:315442003	Ethnic origins in Hungary (finding)
Spain 	Spain 	snomedCT	SNOMEDCT:315526007	Ethnic origins in Spain (finding)
Trinidad and Tobago 	Trinidad and Tobago 	snomedCT	SNOMEDCT:315545003	Ethnic origins in Trinidad and Tobago (finding)
Afghanistan 	Afghanistan 	snomedCT	SNOMEDCT:315365009	Ethnic origins in Afghanistan (finding)
Benin 	Benin 	snomedCT	SNOMEDCT:315384007	Ethnic origins in Benin (finding)
Papua New Guinea 	Papua New Guinea 	snomedCT	SNOMEDCT:315499006	Ethnic origins in Papua New Guinea (finding)
Bahrain 	Bahrain 	snomedCT	SNOMEDCT:315378009	Ethnic origins in Bahrain (finding)
Israel 	Israel 	snomedCT	SNOMEDCT:315449007	Ethnic origins in Israel (finding)
St. Lucia 	St. Lucia 	snomedCT	SNOMEDCT:315529000	Ethnic origins in St. Lucia (finding)
Lithuania 	Lithuania 	snomedCT	SNOMEDCT:315468005	Ethnic origins in Lithuania (finding)
Mauritius 	Mauritius 	snomedCT	SNOMEDCT:315478008	Ethnic origins in Mauritius (finding)
Saudi Arabia 	Saudi Arabia 	snomedCT	SNOMEDCT:315514002	Ethnic origins in Saudi Arabia (finding)
South Africa 	South Africa 	snomedCT	SNOMEDCT:315524005	Ethnic origins in South Africa (finding)
United Arab Emirates 	United Arab Emirates 	snomedCT	SNOMEDCT:315553006	Ethnic origins in United Arab Emirates (finding)
Czech Republic 	Czech Republic 	snomedCT	SNOMEDCT:315412001	Ethnic origins in Czech Republic (finding)
Taiwan 	Taiwan 	snomedCT	SNOMEDCT:315537008	Ethnic origins in Taiwan (finding)
Zambia 	Zambia 	snomedCT	SNOMEDCT:315564009	Ethnic origins in Zambia (finding)
Burkina Faso 	Burkina Faso 	snomedCT	SNOMEDCT:315393008	Ethnic origins in Burkina Faso (finding)
Paraguay 	Paraguay 	snomedCT	SNOMEDCT:315500002	Ethnic origins in Paraguay (finding)
Kosovo 	Kosovo 	snomedCT	SNOMEDCT:315458000	Ethnic origins in Kosovo (finding)
Bosnia - Herzegovnia 	Bosnia - Herzegovnia 	snomedCT	SNOMEDCT:315387000	Ethnic origins in Bosnia - Herzegovnia (finding)
Cyprus 	Cyprus 	snomedCT	SNOMEDCT:315411008	Ethnic origins in Cyprus (finding)
Seychelles 	Seychelles 	snomedCT	SNOMEDCT:315517009	Ethnic origins in Seychelles (finding)
Antigua and Barbuda 	Antigua and Barbuda 	snomedCT	SNOMEDCT:315370002	Ethnic origins in Antigua and Barbuda (finding)
Kyrgyzstan 	Kyrgyzstan 	snomedCT	SNOMEDCT:315460003	Ethnic origins in Kyrgyzstan (finding)
Madagascar 	Madagascar 	snomedCT	SNOMEDCT:315470001	Ethnic origins in Madagascar (finding)
Columbia 	Columbia 	snomedCT	SNOMEDCT:315405005	Ethnic origins in Columbia (finding)
Nauru 	Nauru 	snomedCT	SNOMEDCT:315486008	Ethnic origins in Nauru (finding)
Uganda 	Uganda 	snomedCT	SNOMEDCT:315551008	Ethnic origins in Uganda (finding)
Sierra Leone 	Sierra Leone 	snomedCT	SNOMEDCT:315518004	Ethnic origins in Sierra Leone (finding)
Chile 	Chile 	snomedCT	SNOMEDCT:315403003	Ethnic origins in Chile (finding)
Gabon 	Gabon 	snomedCT	SNOMEDCT:315428006	Ethnic origins in Gabon (finding)
Norway 	Norway 	snomedCT	SNOMEDCT:315494001	Ethnic origins in Norway (finding)
St. Vincent 	St. Vincent 	snomedCT	SNOMEDCT:315530005	Ethnic origins in St. Vincent (finding)
Kazakhstan 	Kazakhstan 	snomedCT	SNOMEDCT:315455002	Ethnic origins in Kazakhstan (finding)
Grenada 	Grenada 	snomedCT	SNOMEDCT:315434004	Ethnic origins in Grenada (finding)
Costa Rica 	Costa Rica 	snomedCT	SNOMEDCT:315408007	Ethnic origins in Costa Rica (finding)
Nicaragua 	Nicaragua 	snomedCT	SNOMEDCT:315489001	Ethnic origins in Nicaragua (finding)
El Salvador 	El Salvador 	snomedCT	SNOMEDCT:315420004	Ethnic origins in El Salvador (finding)
Egypt 	Egypt 	snomedCT	SNOMEDCT:315419005	Ethnic origins in Egypt (finding)
Cameroon 	Cameroon 	snomedCT	SNOMEDCT:315397009	Ethnic origins in Cameroon (finding)
Somalia 	Somalia 	snomedCT	SNOMEDCT:315523004	Ethnic origins in Somalia (finding)
Honduras 	Honduras 	snomedCT	SNOMEDCT:315440006	Ethnic origins in Honduras (finding)
Zaire 	Zaire 	snomedCT	SNOMEDCT:315563003	Ethnic origins in Zaire (finding)
Vietnam 	Vietnam 	snomedCT	SNOMEDCT:315559005	Ethnic origins in Vietnam (finding)
Luxembourg 	Luxembourg 	snomedCT	SNOMEDCT:315469002	Ethnic origins in Luxembourg (finding)
Panama 	Panama 	snomedCT	SNOMEDCT:315498003	Ethnic origins in Panama (finding)
Western Samoa 	Western Samoa 	snomedCT	SNOMEDCT:315561001	Ethnic origins in Western Samoa (finding)
Guyana 	Guyana 	snomedCT	SNOMEDCT:315438001	Ethnic origins in Guyana (finding)
Yemen 	Yemen 	snomedCT	SNOMEDCT:315590007	Ethnic origins in Yemen (finding)
Algeria 	Algeria 	snomedCT	SNOMEDCT:315367001	Ethnic origins in Algeria (finding)
Bahamas 	Bahamas 	snomedCT	SNOMEDCT:315377004	Ethnic origins in Bahamas (finding)
Romania 	Romania 	snomedCT	SNOMEDCT:315509001	Ethnic origins in Romania (finding)
Burma 	Burma 	snomedCT	SNOMEDCT:315394002	Ethnic origins in Burma (finding)
Iceland 	Iceland 	snomedCT	SNOMEDCT:315443008	Ethnic origins in Iceland (finding)
Tuvala 	Tuvala 	snomedCT	SNOMEDCT:315549009	Ethnic origins in Tuvala (finding)
China 	China 	snomedCT	SNOMEDCT:315404009	Ethnic origins in China (finding)
Azerbaijan 	Azerbaijan 	snomedCT	SNOMEDCT:315376008	Ethnic origins in Azerbaijan (finding)
Libya 	Libya 	snomedCT	SNOMEDCT:315466009	Ethnic origins in Libya (finding)
Sudan 	Sudan 	snomedCT	SNOMEDCT:315531009	Ethnic origins in Sudan (finding)
South Korea 	South Korea 	snomedCT	SNOMEDCT:315525006	Ethnic origins in South Korea (finding)
Russia 	Russia 	snomedCT	SNOMEDCT:315510006	Ethnic origins in Russia (finding)
Qatar 	Qatar 	snomedCT	SNOMEDCT:315506008	Ethnic origins in Qatar (finding)
Guatemala 	Guatemala 	snomedCT	SNOMEDCT:315435003	Ethnic origins in Guatemala (finding)
Latvia 	Latvia 	snomedCT	SNOMEDCT:315462006	Ethnic origins in Latvia (finding)
Greece 	Greece 	snomedCT	SNOMEDCT:315433005	Ethnic origins in Greece (finding)
Venezuela 	Venezuela 	snomedCT	SNOMEDCT:315558002	Ethnic origins in Venezuela (finding)
Namibia 	Namibia 	snomedCT	SNOMEDCT:315485007	Ethnic origins in Namibia (finding)
Kenya 	Kenya 	snomedCT	SNOMEDCT:315456001	Ethnic origins in Kenya (finding)
Tunisia 	Tunisia 	snomedCT	SNOMEDCT:315546002	Ethnic origins in Tunisia (finding)
Bangladesh 	Bangladesh 	snomedCT	SNOMEDCT:315379001	Ethnic origins in Bangladesh (finding)
Scotland 	Scotland 	snomedCT	SNOMEDCT:315515001	Ethnic origins in Scotland (finding)
Uruguay 	Uruguay 	snomedCT	SNOMEDCT:315554000	Ethnic origins in Uruguay (finding)
Morocco 	Morocco 	snomedCT	SNOMEDCT:315483000	Ethnic origins in Morocco (finding)
Jamaica 	Jamaica 	snomedCT	SNOMEDCT:315452004	Ethnic origins in Jamaica (finding)
Malawi 	Malawi 	snomedCT	SNOMEDCT:315471002	Ethnic origins in Malawi (finding)
Suriname 	Suriname 	snomedCT	SNOMEDCT:315532002	Ethnic origins in Suriname (finding)
The Netherlands 	The Netherlands 	snomedCT	SNOMEDCT:315542000	Ethnic origins in The Netherlands (finding)
Belgium 	Belgium 	snomedCT	SNOMEDCT:315381004	Ethnic origins in Belgium (finding)
St. Kitts and Nevis 	St. Kitts and Nevis 	snomedCT	SNOMEDCT:315528008	Ethnic origins in St. Kitts and Nevis (finding)
Uzbekistan 	Uzbekistan 	snomedCT	SNOMEDCT:315555004	Ethnic origins in Uzbekistan (finding)
Tanzania 	Tanzania 	snomedCT	SNOMEDCT:315539006	Ethnic origins in Tanzania (finding)
Kuwait 	Kuwait 	snomedCT	SNOMEDCT:315459008	Ethnic origins in Kuwait (finding)
New Zealand 	New Zealand 	snomedCT	SNOMEDCT:315488009	Ethnic origins in New Zealand (finding)
British Guyana 	British Guyana 	snomedCT	SNOMEDCT:315390006	Ethnic origins in British Guyana (finding)
Ecuador 	Ecuador 	snomedCT	SNOMEDCT:315418002	Ethnic origins in Ecuador (finding)
Albania 	Albania 	snomedCT	SNOMEDCT:315366005	Ethnic origins in Albania (finding)
San Marino 	San Marino 	snomedCT	SNOMEDCT:315512003	Ethnic origins in San Marino (finding)
Equatorial Guinea 	Equatorial Guinea 	snomedCT	SNOMEDCT:315422007	Ethnic origins in Equatorial Guinea (finding)
Northern Ireland 	Northern Ireland 	snomedCT	SNOMEDCT:315493007	Ethnic origins in Northern Ireland (finding)
Democratic People's Republic of Korea 	Democratic People's Republic of Korea 	snomedCT	SNOMEDCT:315413006	Ethnic origins in Democratic People's Republic of Korea (finding)
Singapore 	Singapore 	snomedCT	SNOMEDCT:315519007	Ethnic origins in Singapore (finding)
Liberia 	Liberia 	snomedCT	SNOMEDCT:315465008	Ethnic origins in Liberia (finding)
Wales 	Wales 	snomedCT	SNOMEDCT:315560000	Ethnic origins in Wales (finding)
Burundi 	Burundi 	snomedCT	SNOMEDCT:315395001	Ethnic origins in Burundi (finding)
Oman 	Oman 	snomedCT	SNOMEDCT:315495000	Ethnic origins in Oman (finding)
Rwanda 	Rwanda 	snomedCT	SNOMEDCT:315511005	Ethnic origins in Rwanda (finding)
Belorussia 	Belorussia 	snomedCT	SNOMEDCT:315383001	Ethnic origins in Belorussia (finding)
Puerto Rico 	Puerto Rico 	snomedCT	SNOMEDCT:315505007	Ethnic origins in Puerto Rico (finding)
Fiji 	Fiji 	snomedCT	SNOMEDCT:315425009	Ethnic origins in Fiji (finding)
Kiribati 	Kiribati 	snomedCT	SNOMEDCT:315457005	Ethnic origins in Kiribati (finding)
Turkey 	Turkey 	snomedCT	SNOMEDCT:315547006	Ethnic origins in Turkey (finding)
Senegal 	Senegal 	snomedCT	SNOMEDCT:315516000	Ethnic origins in Senegal (finding)
Guinea Bissau 	Guinea Bissau 	snomedCT	SNOMEDCT:315436002	Ethnic origins in Guinea Bissau (finding)
Austria 	Austria 	snomedCT	SNOMEDCT:315375007	Ethnic origins in Austria (finding)
Mozambique 	Mozambique 	snomedCT	SNOMEDCT:315484006	Ethnic origins in Mozambique (finding)
Chad 	Chad 	snomedCT	SNOMEDCT:315401001	Ethnic origins in Chad (finding)
Armenia 	Armenia 	snomedCT	SNOMEDCT:315373000	Ethnic origins in Armenia (finding)
Botswana 	Botswana 	snomedCT	SNOMEDCT:315388005	Ethnic origins in Botswana (finding)
Bulgaria 	Bulgaria 	snomedCT	SNOMEDCT:315392003	Ethnic origins in Bulgaria (finding)
Ghana 	Ghana 	snomedCT	SNOMEDCT:315432000	Ethnic origins in Ghana (finding)
Barbados 	Barbados 	snomedCT	SNOMEDCT:315380003	Ethnic origins in Barbados (finding)
Chechnya 	Chechnya 	snomedCT	SNOMEDCT:315402008	Ethnic origins in Chechnya (finding)
Slovakia 	Slovakia 	snomedCT	SNOMEDCT:315520001	Ethnic origins in Slovakia (finding)
Mauritania 	Mauritania 	snomedCT	SNOMEDCT:315477003	Ethnic origins in Mauritania (finding)
Andorra 	Andorra 	snomedCT	SNOMEDCT:315368006	Ethnic origins in Andorra (finding)
Ireland 	Ireland 	snomedCT	SNOMEDCT:315448004	Ethnic origins in Ireland (finding)
Republic of Ireland 	Republic of Ireland 	snomedCT	SNOMEDCT:315507004	Ethnic origins in Republic of Ireland (finding)
Italy 	Italy 	snomedCT	SNOMEDCT:315450007	Ethnic origins in Italy (finding)
Thailand 	Thailand 	snomedCT	SNOMEDCT:315540008	Ethnic origins in Thailand (finding)
India 	India 	snomedCT	SNOMEDCT:315444002	Ethnic origins in India (finding)
Tajikistan 	Tajikistan 	snomedCT	SNOMEDCT:315538003	Ethnic origins in Tajikistan (finding)
Pakistan 	Pakistan 	snomedCT	SNOMEDCT:315496004	Ethnic origins in Pakistan (finding)
Palestine 	Palestine 	snomedCT	SNOMEDCT:315497008	Ethnic origins in Palestine (finding)
Swaziland 	Swaziland 	snomedCT	SNOMEDCT:315533007	Ethnic origins in Swaziland (finding)
Ethiopia 	Ethiopia 	snomedCT	SNOMEDCT:315424008	Ethnic origins in Ethiopia (finding)
Yugoslavia 	Yugoslavia 	snomedCT	SNOMEDCT:315562008	Ethnic origins in Yugoslavia (finding)
Portugal 	Portugal 	snomedCT	SNOMEDCT:315504006	Ethnic origins in Portugal (finding)
Togo 	Togo 	snomedCT	SNOMEDCT:315543005	Ethnic origins in Togo (finding)
Japan 	Japan 	snomedCT	SNOMEDCT:315453009	Ethnic origins in Japan (finding)
Gambia 	Gambia 	snomedCT	SNOMEDCT:315429003	Ethnic origins in Gambia (finding)
Guinea Republic 	Guinea Republic 	snomedCT	SNOMEDCT:315437006	Ethnic origins in Guinea Republic (finding)
Iraq 	Iraq 	snomedCT	SNOMEDCT:315447009	Ethnic origins in Iraq (finding)
Vanuatu 	Vanuatu 	snomedCT	SNOMEDCT:315556003	Ethnic origins in Vanuatu (finding)
Bolivia 	Bolivia 	snomedCT	SNOMEDCT:315386009	Ethnic origins in Bolivia (finding)
Cape Verde Islands 	Cape Verde Islands 	snomedCT	SNOMEDCT:315399007	Ethnic origins in Cape Verde Islands (finding)
Lesotho 	Lesotho 	snomedCT	SNOMEDCT:315464007	Ethnic origins in Lesotho (finding)
Dominican Republic 	Dominican Republic 	snomedCT	SNOMEDCT:315416003	Ethnic origins in Dominican Republic (finding)
Sao Tome and Principe 	Sao Tome and Principe 	snomedCT	SNOMEDCT:315513008	Ethnic origins in Sao Tome and Principe (finding)
Monaco 	Monaco 	snomedCT	SNOMEDCT:315481003	Ethnic origins in Monaco (finding)
Slovenia 	Slovenia 	snomedCT	SNOMEDCT:315521002	Ethnic origins in Slovenia (finding)
East Timor 	East Timor 	snomedCT	SNOMEDCT:315417007	Ethnic origins in East Timor (finding)
France 	France 	snomedCT	SNOMEDCT:315427001	Ethnic origins in France (finding)
Mexico 	Mexico 	snomedCT	SNOMEDCT:315479000	Ethnic origins in Mexico (finding)
Brazil 	Brazil 	snomedCT	SNOMEDCT:315389002	Ethnic origins in Brazil (finding)
Cambodia 	Cambodia 	snomedCT	SNOMEDCT:315396000	Ethnic origins in Cambodia (finding)
Solomon Islands 	Solomon Islands 	snomedCT	SNOMEDCT:315522009	Ethnic origins in Solomon Islands (finding)
Ukraine 	Ukraine 	snomedCT	SNOMEDCT:315552001	Ethnic origins in Ukraine (finding)
Brunei 	Brunei 	snomedCT	SNOMEDCT:315391005	Ethnic origins in Brunei (finding)
Liechtenstein 	Liechtenstein 	snomedCT	SNOMEDCT:315467000	Ethnic origins in Liechtenstein (finding)
